{
  "on_device": {
    "latency_ms": {
      "value": 15,
      "source": "estimated",
      "source_reference": "DEMO MODEL \u2014 replace with application measurements",
      "method": "sum_of_processing_components",
      "scope": "end_to_end",
      "assumptions": [
        "Preprocessing and postprocessing are hypothetical example timings",
        "0.45 ms inference is a MobileNetV2 S25 profile, not an entire-app latency measurement"
      ],
      "latency_components_ms": {
        "preprocessing": 7,
        "inference": 0.45,
        "postprocessing": 7.55
      }
    },
    "monthly_cost_inr": {
      "value": 900,
      "source": "estimated",
      "source_reference": "DEMO COST \u2014 Person 3 must replace with actual cost model",
      "method": "monthly_component_sum",
      "scope": "cost",
      "assumptions": [
        "Illustrative Indian rupee amounts for demonstration only"
      ],
      "cost_components_inr": {
        "device_amortization": 100,
        "energy": 100,
        "operations": 700
      }
    }
  },
  "far_edge": {
    "latency_ms": {
      "value": 30,
      "source": "estimated",
      "source_reference": "DEMO NETWORK MODEL \u2014 not a measurement",
      "method": "sum_of_processing_and_network_components",
      "scope": "end_to_end",
      "assumptions": [
        "Illustrative RTT and transfer durations; not verified infrastructure values"
      ],
      "latency_components_ms": {
        "preprocessing": 5,
        "upload": 7,
        "network_rtt": 5,
        "queue": 2,
        "inference": 5,
        "postprocessing": 2,
        "download": 4
      }
    },
    "monthly_cost_inr": {
      "value": 500,
      "source": "estimated",
      "source_reference": "DEMO COST \u2014 Person 3 must replace",
      "method": "monthly_component_sum",
      "scope": "cost",
      "assumptions": [
        "Illustrative pricing, not a quote"
      ],
      "cost_components_inr": {
        "compute": 150,
        "network": 150,
        "operations": 200
      }
    }
  },
  "regional_edge": {
    "latency_ms": {
      "value": 55,
      "source": "estimated",
      "source_reference": "DEMO NETWORK MODEL \u2014 not a measurement",
      "method": "sum_of_processing_and_network_components",
      "scope": "end_to_end",
      "assumptions": [
        "Illustrative transfer and processing durations"
      ],
      "latency_components_ms": {
        "preprocessing": 5,
        "upload": 15,
        "network_rtt": 20,
        "queue": 4,
        "inference": 5,
        "postprocessing": 2,
        "download": 4
      }
    },
    "monthly_cost_inr": {
      "value": 1100,
      "source": "estimated",
      "source_reference": "DEMO COST \u2014 Person 3 must replace",
      "method": "monthly_component_sum",
      "scope": "cost",
      "assumptions": [
        "Illustrative monthly amounts"
      ],
      "cost_components_inr": {
        "compute": 700,
        "network": 150,
        "operations": 250
      }
    }
  },
  "cloud": {
    "latency_ms": {
      "value": 120,
      "source": "estimated",
      "source_reference": "DEMO NETWORK MODEL \u2014 not a measurement",
      "method": "sum_of_processing_and_network_components",
      "scope": "end_to_end",
      "assumptions": [
        "Illustrative upload, queue, RTT, and return path durations"
      ],
      "latency_components_ms": {
        "preprocessing": 5,
        "upload": 22,
        "network_rtt": 60,
        "queue": 8,
        "inference": 7,
        "postprocessing": 2,
        "download": 16
      }
    },
    "monthly_cost_inr": {
      "value": 300,
      "source": "estimated",
      "source_reference": "DEMO COST \u2014 Person 3 must replace",
      "method": "monthly_component_sum",
      "scope": "cost",
      "assumptions": [
        "Illustrative, not a public cloud provider price quote"
      ],
      "cost_components_inr": {
        "compute": 100,
        "network": 0,
        "operations": 200
      }
    }
  }
}
